"","var","varDescrip","module"
"424","md119xd","friend: person respondent went to seek help","men"
"425","md119xe","police: person respondent went to seek help","men"
"426","md119xf","religious leader: person respondent went to seek help","men"
"427","md119xg","lawyer: person respondent went to seek help","men"
"428","md119xh","doctor: person respondent went to seek help","men"
"429","md119xi","local leader: person respondent went to seek help","men"
"430","md121","respondent's father ever beat his mother","men"
"431","md122a","interview interrupted: wife's presence","men"
"432","md122b","interview interrupted: other adult female's presence","men"
"433","md122c","interview interrupted: adult male's presence","men"
"434","md124","ever forced to have sex by anyone other than husband/partner in last 12 months","men"
"435","md125","ever forced to perform unwanted sexual acts","men"
"436","md126","age at first forced sexual act","men"
"437","md127","person who forced respondent into first sexual act","men"
"438","md128","ever told anyone else about violence","men"
"439","md129","respondent afraid of wife/partner most of the time, sometimes or never","men"
"440","md130a","previous wife/partner: ever hit, slap, kick or physically hurt respondent","men"
"441","md130b","previous wife/partner: physically forced to have sex or to perform sexual acts","men"
"442","smlang","language of the interview","men"
"443","smtrans","translator used","men"
"444","smdistrict","district","men"
"445","sm105","highest educational level","men"
"446","sm106","highest grade/form/year at that level","men"
"447","sm106a","highest educational level - report","men"
"448","sm115","numbers of trips away during last 12 months","men"
"449","sm205aa","boarding school: where sons/daughters live","men"
"450","sm205ab","relative: where sons/daughters live","men"
"451","sm205ac","in the street: where sons/daughters live","men"
"452","sm205ad","work: where sons/daughters live","men"
"453","sm205ae","married: where sons/daughters live","men"
"454","sm205ax","other: where sons/daughters live","men"
"455","sm205az","don't know: where sons/daughters live","men"
"456","sm302d","read in family planning brochure/pamphlet","men"
"457","sm424a1","last sexual partner: number of times had sex with in last month","men"
"458","sm424a2","second to last sexual partner: number of times had sex with in last month","men"
"459","sm424a3","third to last sexual partner: number of times had sex with in last month","men"
"460","sm427a","total number of partners in the last 12 months for respondents with 3 or more pa","men"
"461","sm614e","beating justified: wife has sex with someone else","men"
"462","sm615a","beating a son justified: if he disobeys","men"
"463","sm615b","beating a son justified: if he is impolite","men"
"464","sm615c","beating a son justified: if he embarrassed the family","men"
"465","sm707a","men reduce changes on aids by getting circumcised","men"
"466","sm711a","tested for aids for prenuptial purposes","men"
"467","sm711c","tested for aids as a couple","men"
"468","sm711d","tested for aids told each other results","men"
"469","sm814a","have the following symptom - cough","men"
"470","sm814b","have the following symptom - fever","men"
"471","sm814c","have the following symptom - drenching night sweats","men"
"472","sm814d","have the following symptom - unexpected weight loss","men"
"473","sm814e","have the following symptom - general fatigue or malaise","men"
"474","sm814f","have the following symptom - chest pain","men"
"475","sm816","have you ever sought help or care for symptom(s)","men"
"476","sm817a","sought advice/treatment from: referral hospital","men"
"477","sm817b","sought advice/treatment from: provincial/district hospital","men"
"478","sm817c","sought advice/treatment from: health center","men"
"479","sm817d","sought advice/treatment from: health post","men"
"480","sm817e","sought advice/treatment from: outreach","men"
"481","sm817f","sought advice/treatment from: community health worker","men"
"482","sm817i","sought advice/treatment from: other public health facility","men"
"483","sm817j","sought advice/treatment from: clinic","men"
"484","sm817k","sought advice/treatment from: pharmacy","men"
"485","sm817m","sought advice/treatment from: polyclinic","men"
"486","sm817n","sought advice/treatment from: dispensary","men"
"487","sm817o","sought advice/treatment from: family planning clinic","men"
"488","sm817p","sought advice/treatment from: other private health facility","men"
"489","sm817s","sought advice/treatment from: kiosk, shop, bar","men"
"490","sm817t","sought advice/treatment from: traditional healer","men"
"491","sm817v","sought advice/treatment from: friend, relative","men"
"492","sm817x","sought advice/treatment from: other","men"
"493","smv044","selection for male domestic violence module","men"
"494","smdvm18","person or persons physically hurt you in the last 12 months","men"
"495","smdvm18c","main person (besides wife/partner) who hurt respondent in last 12 months","men"
"496","smdvm24","anyone (besides wife/partner) forced respondent to have intercourse in last 12 m","men"
"497","smdvm24a","person (besides wife/partner) who forced respondent to have intercourse in last ","men"
"498","smhv044","household selected for domestic violence","men"
