"","var","varDescrip","module"
"1","mcaseid","case identification","men"
"2","mv000","country code and phase","men"
"3","mv001","cluster number","men"
"4","mv002","household number","men"
"5","mv003","respondent's line number","men"
"6","mv004","ultimate area unit","men"
"7","mv005","men's sample weight (6 decimals)","men"
"8","mv006","month of interview","men"
"9","mv007","year of interview","men"
"10","mv008","date of interview (cmc)","men"
"11","mv009","month of birth","men"
"12","mv010","year of birth","men"
"13","mv011","date of birth (cmc)","men"
"14","mv012","current age","men"
"15","mv013","age in 5-year groups","men"
"16","mv014","completeness of age information","men"
"17","mv015","result of interview","men"
"18","mv016","day of interview","men"
"19","mv021","primary sampling unit","men"
"20","mv022","sample strata for sampling errors","men"
"21","mv023","stratification used in sample design","men"
"22","mv024","province","men"
"23","mv025","type of place of residence","men"
"24","mv027","number of visits","men"
"25","mv028","interviewer identification","men"
"26","mv029","keyer identification","men"
"27","mv030","field supervisor","men"
"28","mv031","field editor","men"
"29","mv032","office editor","men"
"30","mv034_1","line number of wife/partner","men"
"31","mv034_2","line number of wife/partner","men"
"32","mv034_3","line number of wife/partner","men"
"33","mv034_4","line number of wife/partner","men"
"34","mv034_5","line number of wife/partner","men"
"35","mv034_6","line number of wife/partner","men"
"36","mv034_7","line number of wife/partner","men"
"37","mv034_8","line number of wife/partner","men"
"38","mv034b_1","age of wife/partner","men"
"39","mv034b_2","age of wife/partner","men"
"40","mv034b_3","age of wife/partner","men"
"41","mv034b_4","age of wife/partner","men"
"42","mv034b_5","age of wife/partner","men"
"43","mv034b_6","age of wife/partner","men"
"44","mv034b_7","age of wife/partner","men"
"45","mv034b_8","age of wife/partner","men"
"46","mv035","number of wives/partners","men"
"47","mv801","time interview started (hhmm - 24 hour clock)","men"
"48","mv802","time interview ended (hhmm - 24 hour clock)","men"
"49","mv803","length of interview in minutes","men"
"50","mv101","province","men"
"51","mv102","type of place of residence","men"
"52","mv106","educational level","men"
"53","mv107","highest year of education (at level in mv106)","men"
"54","mv130","religion","men"
"55","mv133","total number of years of education","men"
"56","mv135","usual resident or visitor","men"
"57","mv136","number of household members (total listed)","men"
"58","mv138","number of eligible men in household (de facto)","men"
"59","mv149","educational attainment","men"
"60","mv150","relationship to household head","men"
"61","mv151","sex of household head","men"
"62","mv152","age of household head","men"
"63","mv155","literacy","men"
"64","mv157","frequency of reading newspaper or magazine","men"
"65","mv158","frequency of listening to radio","men"
"66","mv159","frequency of watching television","men"
"67","mv167","times away from home in last 12 months","men"
"68","mv168","away for more than one month in last 12 months","men"
"69","mv190","wealth index","men"
"70","mv191","wealth index factor score (5 decimals)","men"
"71","mv201","total children ever born","men"
"72","mv202","sons at home","men"
"73","mv203","daughters at home","men"
"74","mv204","sons elsewhere","men"
"75","mv205","daughters elsewhere","men"
"76","mv206","sons who have died","men"
"77","mv207","daughters who have died","men"
"78","mv212","age of respondent at 1st birth","men"
"79","mv213","partner currently pregnant","men"
"80","mv217","knowledge of ovulatory cycle","men"
"81","mv218","number of living children","men"
"82","mv245","number of women fathered children with","men"
"83","mv247","age of most recent child","men"
"84","mv248","antenatal check-ups for the mother of most recent child","men"
"85","mv249","respondent present during check-ups for most recent child","men"
"86","mv250","place of birth of most recent child","men"
"87","mv252","amount a child should drink, when that child has diarrhea","men"
"88","mv301","knowledge of any contraceptive method","men"
"89","m304a_01","type of contraceptive method","men"
"90","m304a_02","type of contraceptive method","men"
"91","m304a_03","type of contraceptive method","men"
"92","m304a_04","type of contraceptive method","men"
"93","m304a_05","type of contraceptive method","men"
"94","m304a_06","type of contraceptive method","men"
"95","m304a_07","type of contraceptive method","men"
"96","m304a_08","type of contraceptive method","men"
"97","m304a_09","type of contraceptive method","men"
"98","m304a_10","type of contraceptive method","men"
"99","m304a_11","type of contraceptive method","men"
"100","m304a_12","type of contraceptive method","men"
"101","m304a_13","type of contraceptive method","men"
"102","m304a_14","type of contraceptive method","men"
"103","m304a_15","type of contraceptive method","men"
"104","m304a_16","type of contraceptive method","men"
"105","m304a_17","type of contraceptive method","men"
"106","m304a_18","type of contraceptive method","men"
"107","m304a_19","type of contraceptive method","men"
"108","m304a_20","type of contraceptive method","men"
"109","mv304_01","knows contraceptive method","men"
"110","mv304_02","knows contraceptive method","men"
"111","mv304_03","knows contraceptive method","men"
"112","mv304_04","knows contraceptive method","men"
"113","mv304_05","knows contraceptive method","men"
"114","mv304_06","knows contraceptive method","men"
"115","mv304_07","knows contraceptive method","men"
"116","mv304_08","knows contraceptive method","men"
"117","mv304_09","knows contraceptive method","men"
"118","mv304_10","knows contraceptive method","men"
"119","mv304_11","knows contraceptive method","men"
"120","mv304_12","knows contraceptive method","men"
"121","mv304_13","knows contraceptive method","men"
"122","mv304_14","knows contraceptive method","men"
"123","mv304_15","knows contraceptive method","men"
"124","mv304_16","knows contraceptive method","men"
"125","mv304_17","knows contraceptive method","men"
"126","mv304_18","knows contraceptive method","men"
"127","mv304_19","knows contraceptive method","men"
"128","mv304_20","knows contraceptive method","men"
"129","mv307_01","contraceptive method currently used","men"
"130","mv307_02","contraceptive method currently used","men"
"131","mv307_03","contraceptive method currently used","men"
"132","mv307_04","contraceptive method currently used","men"
"133","mv307_05","contraceptive method currently used","men"
"134","mv307_06","contraceptive method currently used","men"
"135","mv307_07","contraceptive method currently used","men"
"136","mv307_08","contraceptive method currently used","men"
"137","mv307_09","contraceptive method currently used","men"
"138","mv307_10","contraceptive method currently used","men"
"139","mv307_11","contraceptive method currently used","men"
"140","mv307_12","contraceptive method currently used","men"
"141","mv307_13","contraceptive method currently used","men"
"142","mv307_14","contraceptive method currently used","men"
"143","mv307_15","contraceptive method currently used","men"
"144","mv307_16","contraceptive method currently used","men"
"145","mv307_17","contraceptive method currently used","men"
"146","mv307_18","contraceptive method currently used","men"
"147","mv307_19","contraceptive method currently used","men"
"148","mv307_20","contraceptive method currently used","men"
"149","mv312","current contraceptive method","men"
"150","mv313","current contraceptive by method type","men"
"151","mv323a","brand of condom used","men"
"152","mv384a","on radio heard about family planning in the last few months","men"
"153","mv384b","on tv saw about family planning in the last few months","men"
"154","mv384c","in newspaper read about family planning in the last few months","men"
"155","mv395","discussed family planning with health worker in last few months","men"
"156","mv3b17","source of condoms","men"
"157","mv3b25a","contraception is woman's business, man should not worry","men"
"158","mv3b25b","women who use contraception become promiscuous","men"
"159","mv463a","smokes cigarettes","men"
"160","mv463b","smokes pipe","men"
"161","mv463c","uses chewing tobacco","men"
"162","mv463d","uses snuff","men"
"163","mv463x","smokes other","men"
"164","mv463z","smokes nothing","men"
"165","mv464","number of cigarettes in last 24 hours","men"
"166","mv474","heard of tuberculosis or tb","men"
"167","mv474a","tuberculosis spread by: air through coughing or sneezing","men"
"168","mv474b","tuberculosis spread by: sharing utensils","men"
"169","mv474c","tuberculosis spread by: touching a person with tb","men"
"170","mv474d","tuberculosis spread by: food","men"
"171","mv474e","tuberculosis spread by: sexual contact","men"
"172","mv474f","tuberculosis spread by: mosquito bites","men"
"173","mv474g","tuberculosis spread by: smoking","men"
"174","mv474x","tuberculosis spread by: other","men"
"175","mv474z","don't know how tuberculosis is spread","men"
"176","mv477","number of injections in last 12 months","men"
"177","mv478","number of injections administered by a health worker","men"
"178","mv480","syringe and needle from new, unopened package","men"
"179","mv483","respondent circumcised","men"
"180","mv483a","age at circumcision","men"
"181","mv483b","who performed the circumcision","men"
"182","mv483c","place where circumcision was done","men"
"183","mv501","current marital status","men"
"184","mv502","currently/formerly/never in union","men"
"185","mv503","number of unions","men"
"186","mv504","currently residing with wife/partner","men"
"187","mv505","number of wives/partners","men"
"188","mv507","month of first cohabitation","men"
"189","mv508","year of first cohabitation","men"
"190","mv509","date of first cohabitation (cmc)","men"
"191","mv510","completeness of date information in mv509","men"
"192","mv511","age at first cohabitation","men"
"193","mv512","years since first cohabitation","men"
"194","mv513","cohabitation duration (grouped)","men"
"195","mv525","age at first sex","men"
"196","mv527","time since last sex","men"
"197","mv528","time since last sex (in days)","men"
"198","mv529","time since last sex (in months)","men"
"199","mv531","age at first sex (imputed)","men"
"200","mv532","flag for mv531","men"
"201","mv535","ever been married or in union","men"
"202","mv536","recent sexual activity","men"
"203","mv602","fertility preference","men"
"204","mv603","preferred waiting time for birth of a/another child","men"
"205","mv604","preferred waiting time for birth of a/another child (grouped)","men"
"206","mv605","desire for more children","men"
"207","mv613","ideal number of children","men"
"208","mv614","ideal number of children (grouped)","men"
"209","mv616","desired time for future birth","men"
"210","mv627","ideal number of boys","men"
"211","mv628","ideal number of girls","men"
"212","mv629","ideal number of either sex","men"
"213","mv633b","wife justified refusing sex: husband has other women","men"
"214","mv714","currently working","men"
"215","mv714a","have a job, but currently absent","men"
"216","mv716","occupation","men"
"217","mv717","occupation (grouped)","men"
"218","mv731","worked in last 12 months","men"
"219","mv732","employment all year/seasonal","men"
"220","mv739","person who usually decides how to spend respondent's earnings","men"
"221","mv741","type of earnings from respondent's work","men"
"222","mv743a","person who should have greater say: respondent's health care","men"
"223","mv743b","person who should have greater say: large household purchases","men"
"224","mv744a","beating justified: wife goes out without telling husband","men"
"225","mv744b","beating justified: wife neglects the children","men"
"226","mv744c","beating justified: wife argues with husband","men"
"227","mv744d","beating justified: wife refuses to have sex with husband","men"
"228","mv744e","beating justified: wife burns food","men"
"229","mv745a","owns a house alone or jointly","men"
"230","mv745b","owns land alone or jointly","men"
"231","mv750","ever heard of a sexually transmitted infection (sti)","men"
"232","mv751","ever heard of aids","men"
"233","mv754cp","reduce risk of getting hiv: always use condoms during sex","men"
"234","mv754dp","reduce risk of getting hiv: have 1 sex partner only, who has no other partners","men"
"235","mv754jp","can get hiv from mosquito bites","men"
"236","mv754wp","can get hiv by sharing food with person who has aids","men"
"237","mv756","a healthy looking person can have hiv","men"
"238","mv761","condom used during last sex with most recent partner","men"
"239","mv761b","condom used during last sex with 2nd to most recent partner","men"
"240","mv761c","condom used during last sex with 3rd to most recent partner","men"
"241","mv762aa","source for condoms: government hospital","men"
"242","mv762ab","source for condoms: provincial / district hospital","men"
"243","mv762ac","source for condoms: health center","men"
"244","mv762ad","source for condoms: health post","men"
"245","mv762ae","source for condoms: outreach","men"
"246","mv762af","source for condoms: community health worker","men"
"247","mv762ag","source for condoms: youth center","men"
"248","mv762ai","source for condoms: other public health facility","men"
"249","mv762aj","source for condoms: private hospital/clinic","men"
"250","mv762ak","source for condoms: pharmacy","men"
"251","mv762am","source for condoms: polyclinic","men"
"252","mv762an","source for condoms: dispensary","men"
"253","mv762ao","source for condoms: family planning clinic","men"
"254","mv762ap","source for condoms: other private health facility","men"
"255","mv762as","source for condoms: kiosk / shop / bar","men"
"256","mv762at","source for condoms: traditional healer","men"
"257","mv762av","source for condoms: friend / relative","men"
"258","mv762ax","source for condoms: other","men"
"259","mv762az","don't know any source for condoms","men"
"260","mv762ba","source for female condoms: government hospital","men"
"261","mv762bb","source for female condoms: provincial / district hospital","men"
"262","mv762bc","source for female condoms: health center","men"
"263","mv762bd","source for female condoms: health post","men"
"264","mv762be","source for female condoms: outreach","men"
"265","mv762bf","source for female condoms: community health worker","men"
"266","mv762bg","source for female condoms: youth center","men"
"267","mv762bi","source for female condoms: other public health facility","men"
"268","mv762bj","source for female condoms: private hospital/clinic","men"
"269","mv762bk","source for female condoms: pharmacy","men"
"270","mv762bm","source for female condoms: polyclinic","men"
"271","mv762bn","source for female condoms: dispensary","men"
"272","mv762bo","source for female condoms: family planning clinic","men"
"273","mv762bp","source for female condoms: other private health facility","men"
"274","mv762bs","source for female condoms: kiosk / shop / bar","men"
"275","mv762bt","source for female condoms: traditional healer","men"
"276","mv762bv","source for female condoms: friend relative","men"
"277","mv762bx","source for female condoms: other","men"
"278","mv762bz","don't know any source for female condoms","men"
"279","mv763a","had any sti in last 12 months","men"
"280","mv763b","had genital sore/ulcer in last 12 months","men"
"281","mv763c","had genital discharge in last 12 months","men"
"282","mv766a","number of sex partners, excluding spouse, in last 12 months","men"
"283","mv766b","number of sex partners, including spouse, in last 12 months","men"
"284","mv767a","relationship with most recent sex partner","men"
"285","mv767b","relationship with 2nd to most recent sex partner","men"
"286","mv767c","relationship with 3rd to most recent sex partner","men"
"287","mv769","can get a condom","men"
"288","mv769a","can get a female condom","men"
"289","mv770","sought advice/treatment for last sti infection","men"
"290","mv770a","sought sti advice/treatment from: government hospital","men"
"291","mv770b","sought sti advice/treatment from: provincial / district hospital","men"
"292","mv770c","sought sti advice/treatment from: health center","men"
"293","mv770d","sought sti advice/treatment from: health post","men"
"294","mv770e","sought sti advice/treatment from: outreach","men"
"295","mv770f","sought sti advice/treatment from: community health worker","men"
"296","mv770g","sought sti advice/treatment from: youth center","men"
"297","mv770i","sought sti advice/treatment from: other public health facility","men"
"298","mv770j","sought sti advice/treatment from: clinic","men"
"299","mv770k","sought sti advice/treatment from: pharmacy","men"
"300","mv770m","sought sti advice/treatment from: polyclinic","men"
"301","mv770n","sought sti advice/treatment from: dispensary","men"
"302","mv770o","sought sti advice/treatment from: family planning clinic","men"
"303","mv770p","sought sti advice/treatment from: other private health facility","men"
"304","mv770s","sought sti advice/treatment from: kiosk / shop / bar","men"
"305","mv770t","sought sti advice/treatment from: traditional healer","men"
"306","mv770v","sought sti advice/treatment from: friend relative","men"
"307","mv770x","sought sti advice/treatment from: other","men"
"308","mv774a","hiv transmitted during pregnancy","men"
"309","mv774b","hiv transmitted during delivery","men"
"310","mv774c","hiv transmitted by breastfeeding","men"
"311","mv777","would want hiv infection in family to remain secret","men"
"312","mv778","willing to care for relative with aids","men"
"313","mv779","a female teacher infected with hiv, but is not sick, should be allowed to contin","men"
"314","mv780","children should be taught about condoms to avoid aids","men"
"315","mv781","ever been tested for hiv","men"
"316","mv783","know a place to get hiv test","men"
"317","mv784a","place for hiv test: government hospital","men"
"318","mv784b","place for hiv test: provincial / district hospital","men"
"319","mv784c","place for hiv test: health center","men"
"320","mv784d","place for hiv test: health post","men"
"321","mv784e","place for hiv test: outreach","men"
"322","mv784f","place for hiv test: community health worker","men"
"323","mv784g","place for hiv test: youth center","men"
"324","mv784h","place for hiv test: correctional facility","men"
"325","mv784i","place for hiv test: other public health facility","men"
"326","mv784j","place for hiv test: clinic","men"
"327","mv784k","place for hiv test: pharmacy","men"
"328","mv784m","place for hiv test: polyclinic","men"
"329","mv784n","place for hiv test: dispensary","men"
"330","mv784o","place for hiv test: family planning clinic","men"
"331","mv784p","place for hiv test: other private health facility","men"
"332","mv784s","place for hiv test: kiosk / shop / bar","men"
"333","mv784t","place for hiv test: traditional healer","men"
"334","mv784v","place for hiv test: friend relative","men"
"335","mv784x","place for hiv test: other","men"
"336","mv785","heard about other stis","men"
"337","mv791","have ever paid anyone in exchange for sex","men"
"338","mv793","paid for sex in last 12 months","men"
"339","mv793a","condom used last time paid for sex in last 12 months","men"
"340","mv793b","condom used every time paid for sex in last 12 months","men"
"341","mv822","wife justified asking husband to use condom if he has sti","men"
"342","mv823","can get hiv by witchcraft or supernatural means","men"
"343","mv824","drugs to avoid hiv transmission to baby during pregnancy","men"
"344","mv825","would buy vegetables from vendor with hiv","men"
"345","mv826a","months ago most recent hiv test","men"
"346","mv828","received result from last hiv test","men"
"347","mv829","place where last hiv test was taken","men"
"348","mv832b","time since last sex with 2nd to most recent partner","men"
"349","mv832c","time since last sex with 3rd to most recent partner","men"
"350","mv833a","used condom every time had sex with most recent partner in last 12 months","men"
"351","mv833b","used condom every time had sex with 2nd to most recent partner in last 12 months","men"
"352","mv833c","used condom every time had sex with 3rd to most recent partner in last 12 months","men"
"353","mv834a","age of most recent partner","men"
"354","mv834b","age of 2nd to most recent partner","men"
"355","mv834c","age of 3rd to most recent partner","men"
"356","mv836","total lifetime number of sex partners","men"
"357","mv852a","how long ago first had sex with most recent partner","men"
"358","mv852b","how long ago first had sex with 2nd most recent partner","men"
"359","mv852c","how long ago first had sex with 3rd most recent partner","men"
"360","mv853a","times in last 12 months had sex with most recent partner","men"
"361","mv853b","times in last 12 months had sex with 2nd most recent partner","men"
"362","mv853c","times in last 12 months had sex with 3rd most recent partner","men"
"363","mv854a","concurrent sexual partners","men"
"364","mv854b","cumulative concurrent sexual partners","men"
"365","md005","weight for domestic violence (6 decimals)","men"
"366","md101a","wife/partner jealous if respondent talks with other women","men"
"367","md101b","wife/partner accuses respondent of unfaithfulness","men"
"368","md101c","wife/partner does not permit respondent to meet friends","men"
"369","md101d","wife/partner tries to limit respondent's contact with family","men"
"370","md101e","wife/partner insists on knowing where respondent is","men"
"371","md102","number of control issues answered 'yes'  (d101x = 1)***","men"
"372","md103a","ever been humiliated by wife/partner","men"
"373","md103b","ever been threatened with harm by wife/partner","men"
"374","md103c","ever been insulted or made to feel bad by wife/partner","men"
"375","md104","experienced any emotional violence (d103x series)***","men"
"376","md105a","ever been pushed, shook or had something thrown by wife/partner","men"
"377","md105b","ever been slapped by wife/partner","men"
"378","md105c","ever been punched with fist or hit by something harmful by wife/partner","men"
"379","md105d","ever been kicked or dragged by wife/partner","men"
"380","md105e","ever been strangled or burnt by wife/partner","men"
"381","md105f","ever been threatened with knife/gun or other weapon by wife/partner","men"
"382","md105h","ever been physically forced into unwanted sex by wife/partner","men"
"383","md105i","ever been forced into other unwanted sexual acts by wife/partner","men"
"384","md105j","ever had arm twisted or hair pulled by wife/partner","men"
"385","md105k","ever been physically forced to perform sexual acts respondent didn't want to","men"
"386","md106","experienced any less severe violence (d105a-c,j) by wife/partner","men"
"387","md107","experienced any severe violence (d105d-f) by wife/partner","men"
"388","md108","experienced any sexual violence (d105h-i,k) by wife/partner","men"
"389","md109","timing of first event (from d105 series) in years after marriage","men"
"390","md110a","ever had bruises because of wife/partner's actions","men"
"391","md110b","ever had eye injuries, sprains, dislocations or burns because of wife/partner's ","men"
"392","md110d","ever had wounds, broken bones, broken teeth or other serious injury because of w","men"
"393","md111","experienced any of listed wife/partner's actions (d110x series)***","men"
"394","md112","respondent ever physically hurt wife/partner when he was not hurting her","men"
"395","md112a","frequency of physically hurting wife/partner in last 12 months","men"
"396","md113","wife/partner drinks alcohol","men"
"397","md114","frequency of wife/partner being drunk","men"
"398","md115b","mother/step-mother: person who has ever physically hurt respondent","men"
"399","md115c","father/step-father: person who has ever physically hurt respondent","men"
"400","md115d","daughter/son: person who has ever physically hurt respondent","men"
"401","md115f","sister/brother: person who has ever physically hurt respondent","men"
"402","md115g","other relative: person who has ever physically hurt respondent","men"
"403","md115k","current girlfriend: person who has ever physically hurt respondent","men"
"404","md115l","former girlfriend: person who has ever physically hurt respondent","men"
"405","md115o","mother-in-law: person who has ever physically hurt respondent","men"
"406","md115p","father-in-law: person who has ever physically hurt respondent","men"
"407","md115q","other in-law: person who has ever physically hurt respondent","men"
"408","md115u","neighbor: person who has ever physically hurt respondent","men"
"409","md115v","teacher: person who has ever physically hurt respondent","men"
"410","md115w","employer: person who has ever physically hurt respondent","men"
"411","md115x","other: person who has ever physically hurt respondent","men"
"412","md115y","no person other than husband/partner ever physically hurt respondent","men"
"413","md115xa","stranger: person who has ever physically hurt respondent","men"
"414","md115xe","police/soldier: person who hurt respondent during a pregnancy","men"
"415","md117a","frequency of being hit in last 12 months by other than wife/partner","men"
"416","md119h","own family: person respondent went to seek help","men"
"417","md119i","wife/partner family: person respondent went to seek help","men"
"418","md119j","current/former wife/partner: person respondent went to seek help","men"
"419","md119k","current/former girlfriend: person respondent went to seek help","men"
"420","md119u","neighbor: person respondent went to seek help","men"
"421","md119x","other: person respondent went to seek help","men"
"422","md119y","respondent did not seek help from anyone","men"
"423","md119xb","social service organization: person respondent went to seek help","men"
